{
  "$schema": "https://json-schema.org/draft/2020-12/schema",
  "$id": "https://example.org/atlante-dei-concorsi/agentic-dispatcher-state.schema.json",
  "title": "Atlante dei Concorsi governed agentic dispatcher state",
  "type": "object",
  "additionalProperties": false,
  "required": [
    "dispatcher_id",
    "mode",
    "status",
    "created_at_utc",
    "updated_at_utc",
    "eligible_label",
    "selected_issue",
    "handoff_prompt",
    "blocking_issues",
    "next_action"
  ],
  "properties": {
    "dispatcher_id": {
      "type": "string",
      "pattern": "^ACU-DISPATCHER-[0-9]{4}$"
    },
    "mode": {
      "type": "string",
      "enum": ["dry_run", "controlled"]
    },
    "status": {
      "type": "string",
      "enum": ["idle", "selected", "blocked", "failed"]
    },
    "created_at_utc": {
      "type": "string"
    },
    "updated_at_utc": {
      "type": "string"
    },
    "eligible_label": {
      "type": "string"
    },
    "selected_issue": {
      "type": ["object", "null"],
      "additionalProperties": false,
      "required": ["number", "title", "url", "labels"],
      "properties": {
        "number": {"type": "integer"},
        "title": {"type": "string"},
        "url": {"type": "string"},
        "labels": {
          "type": "array",
          "items": {"type": "string"}
        }
      }
    },
    "handoff_prompt": {
      "type": ["string", "null"]
    },
    "blocking_issues": {
      "type": "array",
      "items": {"type": "string"}
    },
    "next_action": {
      "type": "string"
    },
    "candidate_count": {
      "type": "integer",
      "minimum": 0
    },
    "label_mutation": {
      "type": "object",
      "additionalProperties": true,
      "properties": {
        "requested": {"type": "boolean"},
        "status": {"type": "string"},
        "added": {"type": "array", "items": {"type": "string"}},
        "removed": {"type": "array", "items": {"type": "string"}}
      }
    },
    "notes": {
      "type": "array",
      "items": {"type": "string"}
    }
  }
}
