{
  "dispatcher_id": "ACU-DISPATCHER-0001",
  "mode": "controlled",
  "status": "idle",
  "created_at_utc": "2026-10-18T13:58:54+00:00",
  "updated_at_utc": "2026-10-18T13:58:54+00:00",
  "eligible_label": "agent-ready",
  "selected_issue": null,
  "handoff_prompt": null,
  "blocking_issues": [],
  "next_action": "No open issue with label `agent-ready` found. Add `agent-ready` to an approved issue.",
  "candidate_count": 0,
  "label_mutation": {
    "requested": true,
    "status": "not_requested",
    "added": [],
    "removed": [],
    "ensured_labels": {}
  },
  "notes": [
    "Dispatcher does not execute Codex directly in this phase.",
    "Dispatcher mutates labels only when explicitly requested in controlled mode.",
    "Dispatcher must only select issues explicitly labelled agent-ready."
  ]
}
